course_name,category,software,certificate,teacher,course_level,course_rating,hours_per_week,course_link,price
"Китайский язык. Фонетика. Простые финали a, o, e, i, u, ü",Китайский язык,,Сертификат Stepik,Ксения Гумарова,Начальный уровень,,15 минут в день,https://stepik.org/course/175863?search=7141433596,600
Китайский язык. Уровень 3.1. Тренажер,Китайский язык,"навигация, история",Сертификат Stepik,Елизавета Рязанова,Средний уровень,5,2-3 часа в неделю,https://stepik.org/course/176096?search=7141433591,1275
Китайский язык. Уровень 2. Тренажер.,Китайский язык,"навигация, история",Сертификат Stepik,Елизавета Рязанова,,5,,https://stepik.org/course/122368?search=7141433592,1275
Подготовка к региональному этапу олимпиады по китайскому языку,Китайский язык,,No,Виктория Хан,,4,,https://stepik.org/course/95445?search=7141433599,0
Китайский через 抖音 (тик-ток),Китайский язык,,No,Фокина Ольга,Средний уровень,5,,https://stepik.org/course/111541?search=7141433601,0
КИТАЙСКИЙ ЯЗЫК. Уровень 3. Часть 1.,Китайский язык,,Сертификат Stepik,Елизавета Рязанова,,5,,https://stepik.org/course/83843?search=7141433606,0
Времена в немецком языке,Немецкий язык,,Сертификат Stepik,Анастасия Ушакова,,,,https://stepik.org/course/195213?search=7141439147,490
Deutsch Essentials: Как понять немецкий (А0-А1),Немецкий язык,реакции,No,Анна Захарова,Начальный уровень,,,https://stepik.org/course/184773?search=7141439148,9900
Themen Aktuell 1-5,Немецкий язык,,No,Нина Давыдова,,1.7,,https://stepik.org/course/69330?search=7141439160,0
Олимпиадный немецкий язык для 2 класса,Немецкий язык,,No,"Ирина Валерьевна Полилова, Языковой центр по подготовке к олимпиадам ""DL CLUB""",Начальный уровень,4.9,2-3 часа в неделю,https://stepik.org/course/202348?search=7141439154,0
Немецкий для новичков. Уровень 1.,Немецкий язык,,No,Данила Бадиков,,3.6,10-20 минут каждый день,https://stepik.org/course/105407?search=7141439158,0
"Курс по страноведению Германии: ""Deutschland - Land und Leute""",Немецкий язык,,No,"Анастасия Бояркина, Елизавета Гериева",Средний уровень,5,,https://stepik.org/course/221217?search=7141439150,0
Немецкий с нуля,Немецкий язык,,No,Юлия Гузь,,4.8,36 часов,https://stepik.org/course/55553?search=7141439156,0
Немецкий язык и культура (Городской Лев),Немецкий язык,философия,Сертификат Stepik,"Aleksej Czernorzeczeński Алексей Чернореченский, Илья Наливкин Ilia Nalivkin",,,,https://stepik.org/course/206618?search=7141439159,4350
Наука: Немецкий язык,Немецкий язык,,No,"ГАОУДО Центр развития талантов ""Аврора""",,5,15 уроков,https://stepik.org/course/87969?search=7141439161,0
DE: Модальные глаголы A1/A2,Немецкий язык,,No,Анна Захарова,Средний уровень,5,,https://stepik.org/course/211580?search=7141439145,500
Олимпиадный немецкий язык для 3 класса,Немецкий язык,,No,"Ирина Валерьевна Полилова, Языковой центр по подготовке к олимпиадам ""DL CLUB""",Начальный уровень,5,2-3 часа в неделю,https://stepik.org/course/205422?search=7141439152,0
Немецкий по фильмам,Немецкий язык,,No,"Антон Майоров, Юлия Гузь",,4.8,12 ак.часов,https://stepik.org/course/57522?search=7141439155,0
Грамматика немецкого языка для медиков и фармацевтов. Морфология,Немецкий язык,,No,"В.О. Федоровская, Т. А. Осипенко",,4.6,,https://stepik.org/course/57742?search=7141439157,0
Немецкий язык. Тренировочные задания для подготовки к ДВИ. 52821,Немецкий язык,,Сертификат Stepik,"МГИМО МИД России, Марина Чигашева",,,,https://stepik.org/course/114505?search=7141439146,5000
Vorbereitung auf DSD II,Немецкий язык,,No,Егор Рыков,Средний уровень,5,,https://stepik.org/course/176619?search=7141439151,0
Deutsch Essentials: Как читать на немецком,Немецкий язык,"R, R",No,Анна Захарова,Начальный уровень,,,https://stepik.org/course/206986?search=7141439149,1500
Основные понятия немецкой грамматики,Немецкий язык,,No,"Михаил Друкаров, Лучихина Лариса, OLGA ZHURAVLEVA",Средний уровень,4.7,3-4 часов в неделю,https://stepik.org/course/123267?search=7141439153,0
Аудирование (французский язык),Французский язык,,Сертификат Stepik,Максим Донцов,Начальный уровень,4,16 часов,https://stepik.org/course/108454?search=7141443501,1900
"Французский язык ""Français de base"" - Ознакомительная версия",Французский язык,,No,Penser en Français - PeF,,4.5,2-3 часа в неделю,https://stepik.org/course/56135?search=7141443500,0
Français général,Французский язык,,No,"Лариса Бабушкина, Зайцев Алексей Анатольевич",Средний уровень,5,108 часов (3 з.е.),https://stepik.org/course/105540?search=7141443499,0
Времена глаголов во французском языке,Французский язык,,No,Елена Емелина,Средний уровень,5,4-6 часов в неделю,https://stepik.org/course/181601?search=7141443489,500
"Базовые времена французских глаголов из рассказа ""Lâcheté""",Французский язык,,Сертификат Stepik,Мария Михнова,Начальный уровень,,,https://stepik.org/course/209442?search=7141443495,2890
Французский язык с нуля до высокого уровня,Французский язык,,Сертификат Stepik,Люсьен Синкпеун,,,,https://stepik.org/course/175353?search=7141443502,5999
Французский язык: грамматика для начинающих,Французский язык,,No,"Maria Oknina, Natalia Skosyrskaya",Начальный уровень,5,30 минут в неделю,https://stepik.org/course/139136?search=7141443490,1000
Французский язык: Les temps du passé et la concordance des temps,Французский язык,,Сертификат Stepik,Ugo Cavitte,Средний уровень,,от 2-х часов в неделю,https://stepik.org/course/190978?search=7141443493,1800
Олимпиада по французскому - в кармане (1 класс),Французский язык,,No,Андрей Сергеевич Кузнецов,Начальный уровень,5,,https://stepik.org/course/211340?search=7141443503,1000
Разговорный французский по сериалу Presque adultes,Французский язык,,No,Elena Golotenko,Средний уровень,,1-2 часа в неделю,https://stepik.org/course/128919?search=7141443494,1000
La Révolution française: l'aspect socioculturel,Французский язык,,No,Мария Самохвалова,Средний уровень,5,7 часов в неделю,https://stepik.org/course/131993?search=7141443497,0
Французский язык с нуля / Знакомство,Французский язык,,No,OLGA Sportiello,Начальный уровень,,,https://stepik.org/course/172102?search=7141443492,400
Французский для начинающих (А0-А1),Французский язык,эмоции,No,Елена Лобанова,Начальный уровень,5,3-5 часов в неделю,https://stepik.org/course/125068?search=7141443485,199
Français pour les académiciens,Французский язык,,No,"Лариса Бабушкина, Зайцев Алексей Анатольевич",Средний уровень,,72 hours (2 credits),https://stepik.org/course/199110?search=7141443504,0
Le Français: des expressions de préférence (8-9 classe),Французский язык,,No,Евгения Мурина,,5,,https://stepik.org/course/69099?search=7141443498,0
Шиба учит французскому: фонетика,Французский язык,,No,Анастасия Кудрявцева,Начальный уровень,,15-20 минут в день,https://stepik.org/course/183996?search=7141443486,2199
Французский язык: фонетика и правила чтения для начинающих,Французский язык,"R, R, тренировки",No,"Maria Oknina, Natalia Skosyrskaya",Начальный уровень,,1-2 часа в неделю,https://stepik.org/course/176755?search=7141443487,1499
Podcast Francais,Французский язык,,No,Ирина Лупанова,Начальный уровень,5,3-4 часа в неделю,https://stepik.org/course/207239?search=7141443488,2480
Тесты по французскому языку (начальный уровень),Французский язык,,Сертификат Stepik,"Anastasia McKenzie, Andrey McKenzie",Начальный уровень,,,https://stepik.org/course/178110?search=7141443491,699
Уроки французского для начинающих,Французский язык,путешествия,No,Женечка Пари,Начальный уровень,4.8,Буквально 5 минут в день,https://stepik.org/course/199068?search=7141443496,0
Создание виртуальной машины Ubuntu в Яндекс облаке,Компьютерные сети,,No,Николай Юрьевич Мищенков,Начальный уровень,4.8,2,https://stepik.org/course/210088?search=7141447487,500
Zabbix 6. Мониторинг IT инфраструктуры предприятия,Компьютерные сети,Zabbix,Сертификат Stepik,Павел Лунин,Начальный уровень,5,4-5 часов в неделю,https://stepik.org/course/218689?search=7141447480,28900
LPI Linux Essentials 010-160 Certification Exam Practice,Компьютерные сети,,Сертификат Stepik,Pragmatic Programmer,Начальный уровень,4.8,3,https://stepik.org/course/195426?search=7141447485,84150
Русский сертификационный экзамен LPI Linux Essentials 010-160,Компьютерные сети,,Сертификат Stepik,Pragmatic Programmer,Начальный уровень,4.8,5,https://stepik.org/course/195504?search=7141447486,990
Организация администрирования компьютерных сетей. Практикум,Компьютерные сети,,Сертификат Stepik,Сергей Совватейкин,Начальный уровень,,2 часа в неделю,https://stepik.org/course/124890?search=7141447497,4096
Курс компьютерные сети. Маршрутизаторы Eltex,Компьютерные сети,,Сертификат Stepik,"Ольга Корчагина, Денис Корчагин, Сергей Гринев",Начальный уровень,4.6,3-4,https://stepik.org/course/193545?search=7141447491,700
Kubernetes для начинающих + практический опыт,Компьютерные сети,,Сертификат Stepik,Rotoro cloud,Начальный уровень,4.9,,https://stepik.org/course/128089?search=7141447483,4990
Тестирование ПО: Manual QA engineer / Ручной тестировщик с нуля,Компьютерные сети,"SQL, Postman, Agile",Сертификат Stepik,Pavel Aladyshkin,Начальный уровень,4.8,5 - 7 часов в неделю,https://stepik.org/course/187739?search=7141447490,1990
Планирование и установка Exchange Server 2016,Компьютерные сети,,Сертификат Stepik,Павел Лунин,Начальный уровень,5,4-5 часов в неделю,https://stepik.org/course/219492?search=7141447481,5800
Организация администрирования компьютерных сетей (PRO),Компьютерные сети,,Сертификат Stepik,Сергей Совватейкин,Начальный уровень,4.2,2 часа в неделю,https://stepik.org/course/89392?search=7141447495,3584
Основы программирования для Linux,Компьютерные сети,,Сертификат Stepik,"Кирилл Кринкин, Марк Заславский",,4.8,3-6 часов в неделю,https://stepik.org/course/548?search=7141447496,0
Оптимизация SQL запросов на примере ClickHouse,Компьютерные сети,SQL,Сертификат Stepik,Трофим Воробьев,Средний уровень,4.9,,https://stepik.org/course/215412?search=7141447484,299
Брокеры сообщений. Apache Kafka,Компьютерные сети,"Java, Apache, Java, Apache, история, архитектура",Сертификат Stepik,Иван Мельников,Средний уровень,4.7,1-2 часа в неделю,https://stepik.org/course/199114?search=7141447492,699
Kubernetes и Helm,Компьютерные сети,Kubernetes,Сертификат Stepik,Антон Ларичев,Начальный уровень,4.8,,https://stepik.org/course/194442?search=7141447489,3999
Основы ОС Linux,Компьютерные сети,,Сертификат Stepik,Александр Ткаченко,Начальный уровень,4.2,3 часа в день,https://stepik.org/course/162676?search=7141447494,399
Курс Linux,Компьютерные сети,,Сертификат Stepik,"Денис Корчагин, Ольга Корчагина",Начальный уровень,4.8,4-5 часов в неделю,https://stepik.org/course/231158?search=7141447488,300
Postfix + Dovecot минимальный почтовый сервер,Компьютерные сети,,No,Юрий Senior,Средний уровень,5,4,https://stepik.org/course/235910?search=7141447479,900
Курс компьютерные сети,Компьютерные сети,,Сертификат Stepik,"Ольга Корчагина, Денис Корчагин, Сергей Гринев",Начальный уровень,5,4-5,https://stepik.org/course/208072?search=7141447482,4990
"Основы работы в консоли Linux, настройка сетевых служб (кластер)",Компьютерные сети,"Nginx, Apache, Nginx, Apache",Сертификат Stepik,Ринат Минязев,Начальный уровень,4.8,4-5 часов в неделю,https://stepik.org/course/74070?search=7141447478,6700
"Docker + Ansible - с нуля, деплой и управление Swarm",Компьютерные сети,"Ansible, Vagrant",Сертификат Stepik,Антон Ларичев,,4.6,,https://stepik.org/course/103647?search=7141447493,3999
Испанский язык | Курс для начинающих | Elemental А1,Испанский язык,,Сертификат Stepik,Умберто Осорио Planeta Español,Начальный уровень,4.6,20 мин. в день,https://stepik.org/course/100429?search=7141454064,5000
Испанский с Алехандро | Первая ступень (А1),Испанский язык,,Сертификат Stepik,Александр Евгеньевич Немчинов,Начальный уровень,5,20-45 минут в день,https://stepik.org/course/193896?search=7141454062,900
Испанский язык для начинающих. Грамматика,Испанский язык,,No,Alena Alma,Начальный уровень,,2-3 часа в неделю,https://stepik.org/course/122692?search=7141454066,499
Испанский язык для начинающих. Грамматика и Лексика,Испанский язык,,No,Alena Alma,Начальный уровень,,2-3 часа в неделю,https://stepik.org/course/199668?search=7141454068,699
Вводный курс | Испанский язык | Быстрый старт для начинающих,Испанский язык,,No,Умберто Осорио Planeta Español,Начальный уровень,4.9,20-40 минут в день,https://stepik.org/course/72211?search=7141454072,0
Испанский / Русский: Прогрессивный курс общей лексики,Испанский язык,графика,Сертификат Stepik,"Alejandro Torres, Maria Paramonova",,5,,https://stepik.org/course/99808?search=7141454071,0
Испанский язык | Курс для начинающих | Elemental А2,Испанский язык,,Сертификат Stepik,Умберто Осорио Planeta Español,Начальный уровень,5,40 мин. в день,https://stepik.org/course/134333?search=7141454061,10000
La lengua español. 8-9 grades.,Испанский язык,,No,Мария Афанасьева,,4.3,,https://stepik.org/course/66702?search=7141454074,0
Все времена испанского языка | Мини-курс | Planeta Espanol,Испанский язык,,No,Умберто Осорио Planeta Español,Начальный уровень,,1 час в день,https://stepik.org/course/206251?search=7141454075,0
Местоимения в испанском языке,Испанский язык,,No,Ольга Левахина,Средний уровень,,4-5 часов в неделю,https://stepik.org/course/212629?search=7141454065,2150
Введение в грамматику испанского языка,Испанский язык,,Сертификат Stepik,"Дарья Толстова, Анна Сулавко, Мария Шевцова, Марина Сёмикова, Ирина Абкадырова, Екатерина Корман",,4.7,30-40 минут на урок. Общая длительность курса 7 недель.,https://stepik.org/course/50224?search=7141454073,0
Shadow Mark SPANISH,Испанский язык,,No,Богдан Мацкевич,Начальный уровень,5,40,https://stepik.org/course/197469?search=7141454077,270
Весь испанский за 1 месяц | Planeta Espanol,Испанский язык,,No,Умберто Осорио Planeta Español,Начальный уровень,,4 часа в неделю,https://stepik.org/course/178059?search=7141454067,5000
Испанский язык для начинающих. Полный курс,Испанский язык,,Сертификат Stepik,Alena Alma,Начальный уровень,,2-3 часа в неделю,https://stepik.org/course/210004?search=7141454070,999
"Учим испанский язык по сериалу ""Élite""",Испанский язык,,No,Uliana Profe,Средний уровень,5,10 минут в день,https://stepik.org/course/128964?search=7141454076,0
Мультфильм Тайна Коко. Учим английский (и немного испанский).,Испанский язык,история,Сертификат Stepik,Oksana Trusova,Начальный уровень,5,,https://stepik.org/course/192635?search=7141454063,800
Испанский | Упражнения | Planeta Espanol,Испанский язык,,No,Умберто Осорио Planeta Español,Начальный уровень,,20 минут в день,https://stepik.org/course/206888?search=7141454069,299
"Тригонометрия с нуля: все, что нужно для ЕГЭ 2025",Маркетинг и продажи,,No,Никита Метелкин,Начальный уровень,5,4-5 часов в неделю,https://stepik.org/course/213307?search=7141462964,200
ОГЭ МАТЕМАТИКА 2025,Маркетинг и продажи,вычисления,No,Анастасия Онлайн-репетитор,Начальный уровень,5,,https://stepik.org/course/123967?search=7141462969,1990
Комбо практических курсов. Биология ЕГЭ 2025,Маркетинг и продажи,,No,Мария Семочкина,Начальный уровень,,,https://stepik.org/course/226977?search=7141462963,1490
ЕГЭ по информатике: B часть (1 - 23 задания),Маркетинг и продажи,,Сертификат Stepik,"Алексей Лазарев, Иосиф Дзеранов",Начальный уровень,4.7,4-5 часов в неделю,https://stepik.org/course/30058?search=7141462960,9990
ЕГЭ по математике 2025: первая часть,Маркетинг и продажи,вычисления,Сертификат Stepik,Тимур 🐍 Гуев,Начальный уровень,5,5-7 часов в неделю,https://stepik.org/course/9737?search=7141462966,1590
PrepTalk | все о предлогах в английском,Маркетинг и продажи,,Сертификат Stepik,Иван Варсовский,Начальный уровень,5,3,https://stepik.org/course/182162?search=7141462972,2990
ЕГЭ по математике 2025: экономическая задача,Маркетинг и продажи,,Сертификат Stepik,Тимур 🐍 Гуев,Начальный уровень,5,3-4 часа в неделю,https://stepik.org/course/22402?search=7141462958,1000
ЕГЭ по английскому и его подводные камни,Маркетинг и продажи,,No,Анастасия Степашкина,,5,зависит от начального уровня подготовки,https://stepik.org/course/106660?search=7141462970,2500
ЕГЭ по информатике. C часть (24 - 27 задания),Маркетинг и продажи,,Сертификат Stepik,"Алексей Лазарев, Иосиф Дзеранов",Начальный уровень,5,4-5 часов в неделю,https://stepik.org/course/59702?search=7141462956,9990
Информатика ЕГЭ 2023. №25: разбор всех возможных типов задач ЕГЭ,Маркетинг и продажи,,Сертификат Stepik,"Светлана Нечаева, Иван Воропаев",,5,,https://stepik.org/course/103008?search=7141462971,900
ЕГЭ Информатика 2025 - Задание 27,Маркетинг и продажи,,Сертификат Stepik,Леонид Шастин,Начальный уровень,5,5-6 часов в неделю,https://stepik.org/course/111154?search=7141462961,1190
ЕГЭ по информатике. Графы,Маркетинг и продажи,,Сертификат Stepik,"Алексей Лазарев, Иосиф Дзеранов",Начальный уровень,,2-3 часа в неделю,https://stepik.org/course/117878?search=7141462967,490
ОГЭ по биологии: кратко и обо всем,Маркетинг и продажи,"психология, поведение",Сертификат Stepik,Анастасия Яковлева,,4.5,36 часов,https://stepik.org/course/64565?search=7141462968,800
СОТОЧКА ПО РУССКОМУ: помощник в подготовке к ЕГЭ 2025,Маркетинг и продажи,тренировки,Сертификат Stepik,Ляйсан Хутова,,5,В курсе 22 часа видео и более 2000 заданий,https://stepik.org/course/92015?search=7141462954,2800
ЕГЭ Информатика №1-23,Маркетинг и продажи,"Python, Excel, Python, логика, логика",Сертификат Stepik,"Светлана Нечаева, Иван Воропаев",Начальный уровень,5,,https://stepik.org/course/104041?search=7141462955,3333
Последний мяу: финальный курс (ЕГЭ 2025),Маркетинг и продажи,,Сертификат Stepik,Ляйсан Хутова,,5,,https://stepik.org/course/54849?search=7141462953,1000
Соточка по информатике. Компьютерный формат ЕГЭ,Маркетинг и продажи,,Сертификат Stepik,"Алексей Лазарев, Иосиф Дзеранов",Начальный уровень,5,4-5 часов в неделю,https://stepik.org/course/118045?search=7141462959,15990
