course_name,category,software,certificate,teacher,course_level,course_rating,hours_per_week,course_link,price
Основы компьютерного зрения: мир глазами машины,Машинное обучение и наука о данных,"Python, PyTorch, Python, PyTorch",No,"Елена Кантонистова, Марк Блуменау",Начальный уровень,5,,https://stepik.org/course/231644?search=7139493569,0
Анализ Данных с Глебом Михайловым (3 курса сразу!),Машинное обучение и наука о данных,"Python, Pandas, Python",No,Глеб Михайлов,Начальный уровень,5,,https://stepik.org/course/200649?search=7139493561,648050
Нейронные сети: Основы глубокого обучения с нуля,Машинное обучение и наука о данных,,Сертификат Stepik,Валерий Никаноров,Начальный уровень,5,,https://stepik.org/course/225292?search=7139493573,990
Машинное Обучение в Python: Большой Курс для Начинающих,Машинное обучение и наука о данных,"Python, Pandas, NumPy, Matplotlib, Jupyter Notebook, HTML, Excel, Python, SQL, Scikit-learn",Сертификат Stepik,Влад Бурмистров,Начальный уровень,5,,https://stepik.org/course/129449?search=7139493556,2465
Машинное обучение: Кросс-валидация и оптимизация гиперпараметров,Машинное обучение и наука о данных,,Сертификат Stepik,Сергей Спирёв,,5,,https://stepik.org/course/214012?search=7139493564,780
Продвинутые методы глубинного обучения,Машинное обучение и наука о данных,,No,"Елена Кантонистова, Евгений Паточенко, Марк Блуменау",Средний уровень,5,,https://stepik.org/course/205676?search=7139493574,3900
Курс по Numpy — Твой путь в AI,Машинное обучение и наука о данных,NumPy,Сертификат Stepik,Сергей Дубинин,Начальный уровень,4.8,,https://stepik.org/course/180256?search=7139493566,343
"Нейронные сети с PyTorch: без формул, только практика!",Машинное обучение и наука о данных,"PyTorch, PyTorch",Сертификат Stepik,Сергей Дубинин,Средний уровень,5,,https://stepik.org/course/186169?search=7139493571,1393
Делаем свой AI-продукт на базе ChatGPT или других LLM моделей.,Машинное обучение и наука о данных,,Сертификат Stepik,"Александр 🍕 Миленькин, Иван Александров",Начальный уровень,4.9,1-2,https://stepik.org/course/178846?search=7139493560,3900
Введение в соревновательный Data Science,Машинное обучение и наука о данных,,Сертификат Stepik,"Александр 🍕 Миленькин, Иван Александров, Вольнов Сергей",Средний уровень,5,10,https://stepik.org/course/108888?search=7139493558,7950
Практический Machine Learning,Машинное обучение и наука о данных,,Сертификат Stepik,"Елена Кантонистова, Евгений Паточенко",Начальный уровень,5,4-5 часов в неделю,https://stepik.org/course/125501?search=7139493559,3900
Пакет курсов: Pandas + Matplotlib + Seaborn,Машинное обучение и наука о данных,,No,Сергей Спирёв,,5,,https://stepik.org/course/211639?search=7139493565,2180
Основы нейронных сетей и NLP,Машинное обучение и наука о данных,"Python, Pandas, NumPy, Python",Сертификат Stepik,"Елена Кантонистова, Мария Макарова",Средний уровень,5,4-5 часов в неделю,https://stepik.org/course/180984?search=7139493570,3900
TensorFlow: от основ математики до глубокого обучения.,Машинное обучение и наука о данных,"Python, TensorFlow, Python, TensorFlow",Сертификат Stepik,Mikhail Gushchinin,Средний уровень,5,4-5 часов в неделю,https://stepik.org/course/211706?search=7139493572,990
Практикум по математике и Python,Машинное обучение и наука о данных,"Python, Python",Сертификат Stepik,Алексей Задойный,Средний уровень,4.8,,https://stepik.org/course/3356?search=7139493568,0
Внедряем AI Ассистентов в разработку | AI DevTools,Машинное обучение и наука о данных,"GitHub, GitLab",Сертификат Stepik,Александр Перевалов,Средний уровень,,2-3 часа в неделю,https://stepik.org/course/230403?search=7139493567,2990
Машинное обучение: Метрики качества классификации и регрессии,Машинное обучение и наука о данных,,Сертификат Stepik,Сергей Спирёв,,5,,https://stepik.org/course/216263?search=7139493563,980
"Пакет курсов ""Data Scientist"": Python + SQL + Машинное обучение",Машинное обучение и наука о данных,"Python, Pandas, NumPy, Matplotlib, Jupyter Notebook, HTML, Excel, Python, SQL, Scikit-learn",No,Влад Бурмистров,,5,71 час видео-лекций + время на выполнение практических заданий,https://stepik.org/course/175382?search=7139493562,3315
Алгоритмы Машинного обучения с нуля,Машинное обучение и наука о данных,,Сертификат Stepik,Вячеслав Колосков,Средний уровень,5,,https://stepik.org/course/68260?search=7139493575,1900
Data Science с Глебом Михайловым,Машинное обучение и наука о данных,"Python, Pandas, Python",Сертификат Stepik,Глеб Михайлов,Начальный уровень,5,,https://stepik.org/course/113596?search=7139493557,2485
Продвинутый SQL,Языки программирования,SQL,Сертификат Stepik,Shultais Education,Средний уровень,4.8,4,https://stepik.org/course/55776?search=7139515396,2920
Объектно-ориентированное программирование на Java,Языки программирования,,Сертификат Stepik,Оксана Еськова,Начальный уровень,5,,https://stepik.org/course/133183?search=7139515399,1870
Python Advanced: от ООП до многопроцессности,Языки программирования,,No,"Сергей Балакирев, Александр Шибаев",Средний уровень,,,https://stepik.org/course/232642?search=7139515394,6890
PRO Go. Алгоритмы и структуры данных,Языки программирования,,No,"Иосиф Дзеранов, Копченин Михаил",Средний уровень,5,4-5 часов в неделю,https://stepik.org/course/201825?search=7139515402,899250
Многопоточность в Python. Multithreading,Языки программирования,"Python, Python",Сертификат Stepik,Александр Шибаев,Средний уровень,5,,https://stepik.org/course/172356?search=7139515400,2490
Jetpack Compose полный курс,Языки программирования,,No,Андрей Сумин,Средний уровень,5,4 - 8 часов в неделю,https://stepik.org/course/125685?search=7139515403,3967
Полный курс Python для начинающих,Языки программирования,"Python, PyCharm, Jupyter Notebook, Python",Сертификат Stepik,Shultais Education,Начальный уровень,4.6,4-5,https://stepik.org/course/52054?search=7139515398,3990
WEB Парсинг на Python,Языки программирования,"HTML, Excel, Selenium",Сертификат Stepik,Павел Хошев,Средний уровень,4.9,15 минут в день,https://stepik.org/course/104774?search=7139515406,3900
"""Поколение Python"": ООП",Языки программирования,"Python, Python",Сертификат Stepik,"Тимур 🐍 Гуев, Артур Харисов, Валерий Светкин, Поколение Python",Средний уровень,4.9,10 часов в неделю,https://stepik.org/course/98974?search=7139515388,5400
Асинхронный Python,Языки программирования,,Сертификат Stepik,Павел Хошев,Начальный уровень,4.8,15 минут в день,https://stepik.org/course/170777?search=7139515397,2900
Основы SQL,Языки программирования,SQL,Сертификат Stepik,Shultais Education,Начальный уровень,5,4,https://stepik.org/course/51562?search=7139515391,3960
SQL с нуля до PRO,Языки программирования,SQL,Сертификат Stepik,Shultais Education,Начальный уровень,4.9,4,https://stepik.org/course/61247?search=7139515395,5390
PRO Go. Базовый курс по структурам данных,Языки программирования,,Сертификат Stepik,"Копченин Михаил, Иосиф Дзеранов",Средний уровень,5,3-6 часов в неделю,https://stepik.org/course/187922?search=7139515405,599250
"Добрый, добрый Python ООП - обучающий курс от Сергея Балакирева",Языки программирования,,Сертификат Stepik,Сергей Балакирев,Средний уровень,4.9,4-5 часов в неделю,https://stepik.org/course/116336?search=7139515393,3000
"Добрый, добрый Django + Docker с Сергеем Балакиревым",Языки программирования,Django,Сертификат Stepik,Сергей Балакирев,Начальный уровень,4.9,,https://stepik.org/course/183363?search=7139515392,2500
"""Поколение Python"": курс для профессионалов",Языки программирования,"Python, Python",Сертификат Stepik,"Тимур 🐍 Гуев, Поколение Python",Продвинутый уровень,5,10 часов в неделю,https://stepik.org/course/82541?search=7139515387,5400
Многопроцессорный Python,Языки программирования,"Python, Python",Сертификат Stepik,Павел Хошев,Начальный уровень,4.9,15 минут в день,https://stepik.org/course/190099?search=7139515401,1900
Проектирование архитектуры и интеграций сервисов (с проверкой),Языки программирования,"HTML, SQL",Сертификат Stepik,No instructor found,Начальный уровень,5,5 часов в неделю,https://stepik.org/course/176504?search=7139515404,25000
"""Поколение Python"": курс для начинающих",Языки программирования,,Сертификат Stepik,Тимур 🐍 Гуев,Начальный уровень,5,,https://stepik.org/course/58852?search=7139515390,0
Асинхронность в Python. Asyncio,Языки программирования,,Сертификат Stepik,Александр Шибаев,Средний уровень,5,,https://stepik.org/course/189436?search=7139515389,2690
Продвинутый Django 5 для продолжающих,Фреймворки и библиотеки,"Django, Git, Bootstrap, Nginx, Nginx",Сертификат Stepik,Илья Перминов,Средний уровень,4.9,5-6 часов в неделю,https://stepik.org/course/177355?search=7139536255,1999
Тестирование JavaScript и React приложений,Фреймворки и библиотеки,"JavaScript, React, JavaScript",Сертификат Stepik,Михаил Непомнящий,Средний уровень,5,1.5-2 часа в неделю,https://stepik.org/course/200433?search=7139536251,1999
Профессия Frontend-разработчик,Фреймворки и библиотеки,"JavaScript, jQuery, HTML, CSS, JavaScript, Bootstrap, Sass, Figma, Figma, Figma, Zeplin, Figma, Figma",No,Михаил Непомнящий,Начальный уровень,5,4-5 часов в неделю,https://stepik.org/course/180789?search=7139536253,8900
Программа курсов: Анализ данных,Фреймворки и библиотеки,"Python, Python",No,"Shultais Education, Роман Медведев, Глеб Михайлов, Анастасия Кузнецова",Начальный уровень,5,4-6 часов в неделю,https://stepik.org/course/210097?search=7139536259,12100
HTML и CSS - полный курс по вёрстке с нуля,Фреймворки и библиотеки,"HTML, CSS, Figma, Figma, Figma, Figma, Figma",Сертификат Stepik,Антон Ларичев,Начальный уровень,4.8,,https://stepik.org/course/146294?search=7139536258,3999
Машинное Обучение в Python: Большой Курс для Начинающих,Фреймворки и библиотеки,"Python, Pandas, NumPy, Matplotlib, Jupyter Notebook, HTML, Excel, Python, SQL, Scikit-learn",Сертификат Stepik,Влад Бурмистров,Начальный уровень,5,,https://stepik.org/course/129449?search=7139536249,2465
Основы Pandas для начинающих,Фреймворки и библиотеки,"Pandas, NumPy",Сертификат Stepik,Роман Медведев,Начальный уровень,4.7,2,https://stepik.org/course/120014?search=7139536264,1990
Бэкенд разработка на Django: с нуля до специалиста,Фреймворки и библиотеки,"Django, GitHub, HTML, Nginx, Nginx",Сертификат Stepik,Илья Фофанов,Начальный уровень,4.7,4,https://stepik.org/course/125859?search=7139536265,1390
"Frontend разработчик на HTML, CSS и JavaScript",Фреймворки и библиотеки,"JavaScript, TypeScript, Vue.js, Git, GitHub, HTML, CSS, JavaScript, Bootstrap, Sass, Figma, Figma, Figma, Figma, Figma",Сертификат Stepik,Исмаил Усеинов,Начальный уровень,5,1 час в день или больше,https://stepik.org/course/113402?search=7139536250,7450
Программа курсов: Фронтенд-разработка,Фреймворки и библиотеки,,No,"Shultais Education, IT Guru, Михаил Непомнящий, Исмаил Усеинов",Начальный уровень,,4-6 часов в неделю,https://stepik.org/course/208811?search=7139536263,10000
"Воркшоп ""FullStack—приложение за час"". Java, React.JS, MySQL",Фреймворки и библиотеки,"Java, JavaScript, React, Spring, JavaScript, Bootstrap, Java, Postman",No,Сергей Камянецкий,Средний уровень,4.8,8,https://stepik.org/course/209588?search=7139536257,2520
Пакет курсов: Pandas + Matplotlib + Seaborn,Фреймворки и библиотеки,,No,Сергей Спирёв,,5,,https://stepik.org/course/211639?search=7139536266,2180
Программа курсов: Бэкенд-разработка на Python,Фреймворки и библиотеки,"Python, Python",No,"Shultais Education, Павел Хошев, Илья Перминов, Антон Щербак, Глеб Учитель",Начальный уровень,,4-6 часов в неделю,https://stepik.org/course/208885?search=7139536260,22500
Django REST Framework (DRF) для начинающих,Фреймворки и библиотеки,Django,Сертификат Stepik,Илья Перминов,Начальный уровень,5,6-8,https://stepik.org/course/179999?search=7139536248,239920
Профессия веб верстальщик. Пакет из 2-х курсов-веб разработке,Фреймворки и библиотеки,"Go, GitHub, HTML, CSS, Bootstrap, Sass, Figma, Figma, Figma, Figma, Figma",No,Дмитрий Фокеев,Начальный уровень,5,4-5 часов в неделю,https://stepik.org/course/121498?search=7139536256,4190
"Пакет курсов ""Data Scientist"": Python + SQL + Машинное обучение",Фреймворки и библиотеки,"Python, Pandas, NumPy, Matplotlib, Jupyter Notebook, HTML, Excel, Python, SQL, Scikit-learn",No,Влад Бурмистров,,5,71 час видео-лекций + время на выполнение практических заданий,https://stepik.org/course/175382?search=7139536254,3315
"Добрый, добрый Django + Docker с Сергеем Балакиревым",Фреймворки и библиотеки,Django,Сертификат Stepik,Сергей Балакирев,Начальный уровень,4.9,,https://stepik.org/course/183363?search=7139536247,2500
Pandas: вопросы на собеседовании и не только,Фреймворки и библиотеки,Pandas,No,Роман Медведев,Средний уровень,4.8,0.5,https://stepik.org/course/133336?search=7139536261,990
Django 5 для начинающих,Фреймворки и библиотеки,"JavaScript, Django, HTML, JavaScript, Bootstrap, Nginx, SQL, Nginx",Сертификат Stepik,Илья Перминов,Средний уровень,5,5-6 часов в неделю,https://stepik.org/course/174634?search=7139536252,1599
Игра на Vue.js,Фреймворки и библиотеки,"JavaScript, Vue.js, Git, GitHub, JavaScript",Сертификат Stepik,Исмаил Усеинов,Средний уровень,4.8,30 минут в день,https://stepik.org/course/99855?search=7139536262,450
Многопроцессорный Python,Веб-разработка,"Python, Python",Сертификат Stepik,Павел Хошев,Начальный уровень,4.9,15 минут в день,https://stepik.org/course/190099?search=7139559469,1900
Тестирование REST API в Postman - легкий старт в автоматизацию,Веб-разработка,"JavaScript, JavaScript, Postman",Сертификат Stepik,Давид Согоян,Начальный уровень,5,8 часов в неделю,https://stepik.org/course/131052?search=7139559477,890
Фундаментальный JavaScript,Веб-разработка,"JavaScript, HTML, JavaScript",Сертификат Stepik,Михаил Непомнящий,Начальный уровень,5,3-5 часов,https://stepik.org/course/114165?search=7139559479,2800
Проектирование архитектуры и интеграций сервисов (с проверкой),Веб-разработка,"HTML, SQL",Сертификат Stepik,No instructor found,Начальный уровень,5,5 часов в неделю,https://stepik.org/course/176504?search=7139559470,25000
Самый полный курс по JavaScript для опытных программистов,Веб-разработка,"JavaScript, JavaScript",Сертификат Stepik,IT Guru,Средний уровень,4.5,,https://stepik.org/course/177315?search=7139559476,1999
Многопоточный Python,Веб-разработка,,Сертификат Stepik,Павел Хошев,Начальный уровень,4.8,15 минут в день,https://stepik.org/course/190100?search=7139559475,1900
Курс по верстке и веб разработке сайтов с нуля! Web development,Веб-разработка,"Go, GitHub, HTML, CSS, Bootstrap, Sass, Figma, Figma, Figma, Figma, Figma",Сертификат Stepik,Дмитрий Фокеев,Начальный уровень,5,4-5 часов в неделю,https://stepik.org/course/114109?search=7139559482,2390
Веб дизайн в Figma с нуля до результата! Основы UX/UI Web Design,Веб-разработка,"Figma, Figma, Figma, Figma, Figma",Сертификат Stepik,Дмитрий Фокеев,Начальный уровень,5,4-5 часов в неделю,https://stepik.org/course/102520?search=7139559481,2390
Тестирование JavaScript и React приложений,Веб-разработка,"JavaScript, React, JavaScript",Сертификат Stepik,Михаил Непомнящий,Средний уровень,5,1.5-2 часа в неделю,https://stepik.org/course/200433?search=7139559486,1999
Django 5 для начинающих,Веб-разработка,"JavaScript, Django, HTML, JavaScript, Bootstrap, Nginx, SQL, Nginx",Сертификат Stepik,Илья Перминов,Средний уровень,5,5-6 часов в неделю,https://stepik.org/course/174634?search=7139559487,1599
Проектирование архитектуры и интеграций сервисов (полный тариф),Веб-разработка,"HTML, SQL",Сертификат Stepik,Глеб Учитель,Начальный уровень,4.8,5 часов в неделю,https://stepik.org/course/170591?search=7139559472,44000
"Вёрстка сайта с нуля • JSX, SCSS, JS, Vite, Minista, БЭМ",Веб-разработка,,Сертификат Stepik,Александр Ламков,Средний уровень,5,10 часов в неделю в течение 1 — 1.5 месяца,https://stepik.org/course/228315?search=7139559478,1999
Самый полный курс по JavaScript для начинающих программистов,Веб-разработка,"JavaScript, JavaScript",Сертификат Stepik,IT Guru,Начальный уровень,4.8,,https://stepik.org/course/134850?search=7139559471,1999
"Frontend разработчик на HTML, CSS и JavaScript",Веб-разработка,"JavaScript, TypeScript, Vue.js, Git, GitHub, HTML, CSS, JavaScript, Bootstrap, Sass, Figma, Figma, Figma, Figma, Figma",Сертификат Stepik,Исмаил Усеинов,Начальный уровень,5,1 час в день или больше,https://stepik.org/course/113402?search=7139559485,7450
FastAPI для начинающих,Веб-разработка,"Nginx, Nginx",Сертификат Stepik,Илья Перминов,Начальный уровень,5,5-6 часов в неделю,https://stepik.org/course/180000?search=7139559480,2499
Django REST Framework (DRF) для начинающих,Веб-разработка,Django,Сертификат Stepik,Илья Перминов,Начальный уровень,5,6-8,https://stepik.org/course/179999?search=7139559473,239920
Основы HTML и CSS,Веб-разработка,"HTML, CSS",Сертификат Stepik,Shultais Education,,5,,https://stepik.org/course/58973?search=7139559488,3900
Старт карьеры в IT. Front-end разработчик сайтов с нуля.,Веб-разработка,"Go, GitHub, HTML, CSS, Bootstrap, Sass, Figma, Figma, Figma, Figma, Figma",No,Дмитрий Фокеев,Начальный уровень,5,4-5 часов в неделю,https://stepik.org/course/175308?search=7139559483,3890
Проектирование архитектуры и интеграций (API / брокеры) сервисов,Веб-разработка,"HTML, SQL",Сертификат Stepik,Глеб Учитель,Начальный уровень,4.6,5 часов в неделю,https://stepik.org/course/175243?search=7139559474,13990
Пакет курсов JavaScript и React разработчика,Веб-разработка,"JavaScript, HTML, JavaScript",No,Михаил Непомнящий,Начальный уровень,,4-5 часов в неделю,https://stepik.org/course/204117?search=7139559484,5400
Android разработка: Базовый курс + Основы программирования,Разработка мобильных приложений,"Java, Android Studio, Java",Сертификат Stepik,Андрей Сумин,Начальный уровень,5,4 - 8 часов в неделю,https://stepik.org/course/121507?search=7139585303,3730
Изучаем iOS с нуля!,Разработка мобильных приложений,,Сертификат Stepik,Oleg Maksimenko,Начальный уровень,5,10-20 часов,https://stepik.org/course/187209?search=7139585304,4999
JAVA – получи Чёрный Пояс!,Разработка мобильных приложений,,No,"Заур Трегулов, Тимур Трегулов",Средний уровень,5,4-5 часов в неделю,https://stepik.org/course/115517?search=7139585307,148750
SwiftUI Layout - верстка,Разработка мобильных приложений,,No,Игорь Шувалов,Средний уровень,5,,https://stepik.org/course/210400?search=7139585301,1000
